{
  "engagement_version": "1.1.0",
  "engagement_id": "replace-with-immutable-engagement-id",
  "status": "draft",
  "cavadalabs_roles": ["evaluator"],
  "counterparty_roles": ["UNASSESSED"],
  "scope": "Template only; measurement target and engagement boundaries are not approved.",
  "suite": {
    "protocol_version": "1.0.0",
    "name": "replace-me",
    "version": "0.0.0",
    "dataset_sha256": "0000000000000000000000000000000000000000000000000000000000000000",
    "rubric_sha256": "0000000000000000000000000000000000000000000000000000000000000000",
    "suite_config_sha256": "0000000000000000000000000000000000000000000000000000000000000000"
  },
  "sut": {"expected_model": "replace-me", "revision": "replace-me"},
  "execution_owner_id": "UNASSIGNED",
  "commercial_owner_id": "UNASSIGNED",
  "system_owner_reference": "UNASSIGNED",
  "jurisdictions": ["UNASSESSED"],
  "requested_claims": ["UNASSESSED"],
  "permitted_claims": ["No external claim while status is draft."],
  "prohibited_claims": ["certified", "accredited", "legally compliant", "universally safe", "universally secure", "universally correct"],
  "conflicts_assessed": false,
  "conflicts": ["NOT-ASSESSED"],
  "complaints_process_reference": "program/POLICY.md#complaints-and-appeals",
  "appeals_process_reference": "program/POLICY.md#complaints-and-appeals",
  "correction_revocation_reference": "program/POLICY.md#correction-revocation-and-lifecycle",
  "disclosure_policy_reference": "program/POLICY.md#disclosure-and-surveillance",
  "surveillance_required": false,
  "surveillance_plan_reference": "",
  "authorization_evidence": "UNAVAILABLE",
  "authorization_evidence_sha256": "0000000000000000000000000000000000000000000000000000000000000000",
  "conflict_assessment_evidence": "UNAVAILABLE",
  "conflict_assessment_evidence_sha256": "0000000000000000000000000000000000000000000000000000000000000000",
  "legal_applicability_evidence": "UNAVAILABLE",
  "legal_applicability_evidence_sha256": "0000000000000000000000000000000000000000000000000000000000000000",
  "approver_qualification_evidence": "UNAVAILABLE",
  "approver_qualification_evidence_sha256": "0000000000000000000000000000000000000000000000000000000000000000",
  "approver_id": "UNASSIGNED",
  "approved_at": "1970-01-01T00:00:00Z",
  "expires_at": "1970-01-01T00:00:00Z"
}
